{"decision":"revise","changeType":"prolog","hypothesis":"Explicit generic input-state predicates will help the student distinguish an absent required input from an unsupported supplied value instead of guessing a material.","studentPrompt":"# Direct representation student contract\n\nUse only the knowledge representation and user question supplied in the current request. Do not use memorised domain facts.\n\nReturn exactly one JSON object and no surrounding prose or Markdown.\n\nSchema:\n\n```json\n{\n  \"action\": \"answer | ask_user\",\n  \"status\": \"success | unknown | need_user\",\n  \"material\": \"string or null\",\n  \"askField\": \"date | revision | null\",\n  \"answerRu\": \"short Russian answer\"\n}\n```\n\nRules:\n\n- Ask the user when the date or revision required by the question is absent.\n- Use `need_user` only with `action=ask_user` and a non-null `askField`.\n- Use `success` only when the supplied representation determines one material.\n- Use `unknown` when the representation does not support the requested revision or cannot determine the answer.\n- Never rewrite `unknown` as `false` and never invent a default.\n- Preserve material identifiers exactly as lowercase `asd2` or `asd100500`.\n- Do not reveal hidden reasoning. Keep `answerRu` concise.\n","prologKnowledge":":- module(epistemic_compiler_knowledge, [\n    current_material/4,\n    expansion/4,\n    expansion_payload/2,\n    assertion_source/2\n]).\n\nsupported_revision(a).\nsupported_revision(b).\n\nrequired_input(revision).\nrequired_input(date).\n\ninput_state(Field, absent, missing) :-\n    required_input(Field).\n\ninput_state(revision, Revision, unsupported) :-\n    nonvar(Revision),\n    Revision \\== absent,\n    \\+ supported_revision(Revision).\n\ninput_state(date, Date, unsupported) :-\n    nonvar(Date),\n    Date \\== absent,\n    \\+ integer(Date).\n\nassertion_source(a1042, _{\n    file:\"EpistemicCompilerLab/sources/materials.md\",\n    section:\"ASD100500\"\n}).\n\ncurrent_material(Revision, Date, asd2, [\"rule:before_transition\"]) :-\n    supported_revision(Revision),\n    integer(Date),\n    Date < 20260701.\n\ncurrent_material(a, Date, asd2, [\n    \"rule:revision_a_exception\",\n    \"assertion:a1042\"\n]) :-\n    integer(Date),\n    Date >= 20260701.\n\ncurrent_material(b, Date, asd100500, [\n    \"rule:default_after_transition\",\n    \"assertion:a1042\"\n]) :-\n    integer(Date),\n    Date >= 20260701.\n\nexpansion(\n    asd100500,\n    evidence,\n    exp_asd100500_evidence,\n    \"Original source section for the replacement rule\"\n).\n\nexpansion(\n    asd100500,\n    exceptions,\n    exp_asd100500_exceptions,\n    \"Hardware revisions that do not use the default material\"\n).\n\nexpansion_payload(exp_asd100500_evidence, _{\n    type:\"markdown\",\n    file:\"EpistemicCompilerLab/sources/materials.md\",\n    section:\"ASD100500\"\n}).\n\nexpansion_payload(exp_asd100500_exceptions, _{\n    type:\"rule_summary\",\n    revisions:[\"a\"],\n    material:\"asd2\",\n    condition:\"date >= 20260701\"\n}).","expectedEffect":"Missing-date and missing-revision responses should become ask_user/need_user with the corresponding field, while supported and unsupported supplied inputs remain unchanged.","risk":"The student may ignore non-exported interface predicates or interpret the atom absent as literal user input rather than a representation of omission."}