{
  "decision": "revise",
  "changeType": "prompt",
  "hypothesis": "The student conflates an absent obligatory field with an unsupported supplied value; an ordered extraction gate with explicit present/absent states should prevent both guessing and false requests.",
  "studentPrompt": "# Direct representation student contract\n\nUse only the knowledge representation and user question supplied in the current request. Do not use memorised domain facts.\n\nReturn exactly one JSON object and no surrounding prose or Markdown.\n\nSchema:\n\n```json\n{\n  \"action\": \"answer | ask_user\",\n  \"status\": \"success | unknown | need_user\",\n  \"material\": \"string or null\",\n  \"askField\": \"date | revision | null\",\n  \"answerRu\": \"short Russian answer\"\n}\n```\n\nRules:\n\n- Before consulting the representation, extract two inputs from the question: `date` and `revision`. Mark each input as either `present` with its supplied value or `absent`.\n- A supplied but unsupported revision is `present`, not `absent`.\n- If `date` is `absent`, return `action=ask_user`, `status=need_user`, `material=null`, `askField=date` and stop.\n- Otherwise, if `revision` is `absent`, return `action=ask_user`, `status=need_user`, `material=null`, `askField=revision` and stop.\n- Do not consult a rule, infer a value, or choose a material until both inputs are `present`.\n- With both inputs present, use `success` only when the supplied representation determines one material.\n- With both inputs present, use `unknown` when the representation does not support the supplied revision or cannot determine the answer; return `action=answer`, `material=null`, and `askField=null`.\n- Never rewrite `unknown` as `false` and never invent a default.\n- Preserve material identifiers exactly as lowercase `asd2` or `asd100500`.\n- Do not reveal hidden reasoning. Keep `answerRu` concise.\n",
  "prologKnowledge": ":- module(epistemic_compiler_knowledge, [\n    current_material/4,\n    expansion/4,\n    expansion_payload/2,\n    assertion_source/2\n]).\n\nsupported_revision(a).\nsupported_revision(b).\n\nassertion_source(a1042, _{\n    file:\"EpistemicCompilerLab/sources/materials.md\",\n    section:\"ASD100500\"\n}).\n\ncurrent_material(Revision, Date, asd2, [\"rule:before_transition\"]) :-\n    supported_revision(Revision),\n    integer(Date),\n    Date < 20260701.\n\ncurrent_material(a, Date, asd2, [\n    \"rule:revision_a_exception\",\n    \"assertion:a1042\"\n]) :-\n    integer(Date),\n    Date >= 20260701.\n\ncurrent_material(b, Date, asd100500, [\n    \"rule:default_after_transition\",\n    \"assertion:a1042\"\n]) :-\n    integer(Date),\n    Date >= 20260701.\n\nexpansion(\n    asd100500,\n    evidence,\n    exp_asd100500_evidence,\n    \"Original source section for the replacement rule\"\n).\n\nexpansion(\n    asd100500,\n    exceptions,\n    exp_asd100500_exceptions,\n    \"Hardware revisions that do not use the default material\"\n).\n\nexpansion_payload(exp_asd100500_evidence, _{\n    type:\"markdown\",\n    file:\"EpistemicCompilerLab/sources/materials.md\",\n    section:\"ASD100500\"\n}).\n\nexpansion_payload(exp_asd100500_exceptions, _{\n    type:\"rule_summary\",\n    revisions:[\"a\"],\n    material:\"asd2\",\n    condition:\"date >= 20260701\"\n}).",
  "expectedEffect": "Missing inputs should trigger the corresponding targeted request, while supplied unsupported revisions remain unknown and fully specified answers remain unchanged.",
  "risk": "The ordered gate asks for date first when both obligatory inputs are absent and may miss unusually implicit field expressions."
}