{"decision":"revise","changeType":"prompt","hypothesis":"The student skips the existing missing-field rule because it is not an explicit gate before material inference; a mandatory completeness check with fixed field precedence should prevent answers from partial input.","studentPrompt":"# Direct representation student contract\n\nUse only the knowledge representation and user question supplied in the current request. Do not use memorised domain facts.\n\nReturn exactly one JSON object and no surrounding prose or Markdown.\n\nSchema:\n\n```json\n{\n  \"action\": \"answer | ask_user\",\n  \"status\": \"success | unknown | need_user\",\n  \"material\": \"string or null\",\n  \"askField\": \"date | revision | null\",\n  \"answerRu\": \"short Russian answer\"\n}\n```\n\nRules:\n\n- Before consulting the representation or choosing a material, verify that the user question explicitly supplies both a date and a revision.\n- If the date is absent, return `action=ask_user`, `status=need_user`, `material=null`, and `askField=date`; do not infer a material.\n- Otherwise, if the revision is absent, return `action=ask_user`, `status=need_user`, `material=null`, and `askField=revision`; do not infer a material.\n- Only after both fields are present may you determine a material from the representation.\n- Use `success` only when the supplied representation determines one material.\n- Use `unknown` when the representation does not support the requested revision or cannot determine the answer.\n- Never rewrite `unknown` as `false` and never invent a default.\n- Preserve material identifiers exactly as lowercase `asd2` or `asd100500`.\n- For every answer response, set `askField` to null. For every unknown response, set both `material` and `askField` to null.\n- Do not reveal hidden reasoning. Keep `answerRu` concise.\n","prologKnowledge":":- module(epistemic_compiler_knowledge, [\n    current_material/4,\n    expansion/4,\n    expansion_payload/2,\n    assertion_source/2\n]).\n\nsupported_revision(a).\nsupported_revision(b).\n\nassertion_source(a1042, _{\n    file:\"EpistemicCompilerLab/sources/materials.md\",\n    section:\"ASD100500\"\n}).\n\ncurrent_material(Revision, Date, asd2, [\"rule:before_transition\"]) :-\n    supported_revision(Revision),\n    integer(Date),\n    Date < 20260701.\n\ncurrent_material(a, Date, asd2, [\n    \"rule:revision_a_exception\",\n    \"assertion:a1042\"\n]) :-\n    integer(Date),\n    Date >= 20260701.\n\ncurrent_material(b, Date, asd100500, [\n    \"rule:default_after_transition\",\n    \"assertion:a1042\"\n]) :-\n    integer(Date),\n    Date >= 20260701.\n\nexpansion(\n    asd100500,\n    evidence,\n    exp_asd100500_evidence,\n    \"Original source section for the replacement rule\"\n).\n\nexpansion(\n    asd100500,\n    exceptions,\n    exp_asd100500_exceptions,\n    \"Hardware revisions that do not use the default material\"\n).\n\nexpansion_payload(exp_asd100500_evidence, _{\n    type:\"markdown\",\n    file:\"EpistemicCompilerLab/sources/materials.md\",\n    section:\"ASD100500\"\n}).\n\nexpansion_payload(exp_asd100500_exceptions, _{\n    type:\"rule_summary\",\n    revisions:[\"a\"],\n    material:\"asd2\",\n    condition:\"date >= 20260701\"\n}).","expectedEffect":"Requests missing either obligatory input should return need_user with the correct askField and null material; complete and unsupported requests should remain unchanged.","risk":"Rigid date-first precedence affects only requests missing both fields and may ask for the date before the revision."}